{
  "@id": "https://doi.org/TEST/PGD-QGK-S0R/1",
  "@type": "ods:CreateUpdateTombstoneEvent",
  "ods:ID": "https://doi.org/TEST/PGD-QGK-S0R/1",
  "ods:type": "https://doi.org/10.15468/1a2b3c",
  "prov:Activity": {
    "@id": "7ba628d4-2e28-4ce4-ad1e-e99c97c20507",
    "@type": "ods:Create",
    "prov:wasAssociatedWith": [
      {
        "@id": "https://orcid.org/0000-0002-1825-0097",
        "prov:hadRole": "ods:Approver"
      },
      {
        "@id": "https://hdl.handle.net/20.5000.1025/XXX-XXX-XXX",
        "prov:hadRole": "ods:Requestor"
      },
      {
        "@id": "https://hdl.handle.net/20.5000.1025/XXX-YYY-XXX",
        "prov:hadRole": "ods:Generator"
      }
    ],
    "prov:endedAtTime": "2024-06-11T09:14:00.348Z",
    "prov:used": "https://doi.org/10.15468/1a2b3c/3",
    "rdfs:comment": "This activity was created by the user",
    "ods:changeValue": []
  },
  "prov:Entity": {
    "@id": "https://doi.org/TEST/PGD-QGK-S0R/1",
    "@type": "ods:DigitalSpecimen",
    "prov:value": {
      "@id": "https://hdl.handle.net/20.5000.1025/ABC-DEF-GHI",
      "@type": "ods:Mapping",
      "ods:ID": "https://hdl.handle.net/20.5000.1025/ABC-DEF-GHI",
      "ods:type": "https://doi.org/10.15468/1a2b3c",
      "schema:version": 1,
      "schema:name": "Default Mapping for Herbarium of University of Coimbra (COI)",
      "schema:description": "The default mapping for the Herbarium of the University of Coimbra (COI) to the Darwin Core standard.",
      "schema:dateCreated": "2021-06-01T12:00:00.676Z",
      "ods:creator": "e2befba6-9324-4bb4-9f41-d7dfae4a44b0",
      "ods:Mapping": {
        "ods:DefaultMapping": [
          {
            "ods:physicalSpecimenIDType": "Global"
          },
          {
            "ods:type": "ZoologyVertebrateSpecimen"
          },
          {
            "ods:organisationId": "https://ror.org/05xg72x27"
          }
        ],
        "ods:FieldMapping": [
          {
            "ods:physicalSpecimenId": "dwc:catalogNumber"
          }
        ]
      },
      "ods:mappingDataStandard": "dwc"
    },
    "prov:wasGeneratedBy": "7ba628d4-2e28-4ce4-ad1e-e99c97c20507"
  },
  "ods:hasProvAgent": [
    {
      "@id": "https://orcid.org/0000-0002-1825-0097",
      "@type": "prov:Person",
      "schema:name": "John Doe"
    },
    {
      "@id": "https://hdl.handle.net/20.5000.1025/XXX-XXX-XXX",
      "@type": "prov:SoftwareAgent",
      "schema:name": "GBIF Linker Service"
    },
    {
      "@id": "https://hdl.handle.net/20.5000.1025/XXX-YYY-XXX",
      "@type": "prov:SoftwareAgent",
      "schema:name": "Digital Specimen Processor"
    }
  ]
}